[
  {
    "item_id": "item-001",
    "legacy_proc": "dbo.MigrateItem",
    "classification": "migrate",
    "reads": "dbo.Item_Staging",
    "writes": "dbo.Item",
    "target_layer": "gold",
    "target_path": "databricks/gold/20_migrate_item.sql",
    "priority": "high",
    "risk_flags": "mutates_db,scd2",
    "status": "converted"
  },
  {
    "item_id": "item-002",
    "legacy_proc": "dbo.MigrateCustomer",
    "classification": "migrate",
    "reads": "dbo.Customer_Staging",
    "writes": "dbo.Customer",
    "target_layer": "gold",
    "target_path": "databricks/gold/21_migrate_customer.sql",
    "priority": "high",
    "risk_flags": "mutates_db,scd2",
    "status": "converted"
  }
]
